{
  "id": "linear-algebra-foundations-to-applications",
  "title": {
    "ja": "線形代数：基礎から応用へ",
    "en": "Linear Algebra: Foundations to Applications"
  },
  "description": {
    "ja": "ベクトルから数値線形代数と応用までを、Knowledge Graphとは分離したCourse順序で学ぶ。",
    "en": "A course from vectors through numerical linear algebra and applications."
  },
  "domain": "linear-algebra",
  "modules": [
    "module-prerequisites-vectors",
    "module-systems-matrices",
    "module-vector-spaces",
    "module-linear-transformations",
    "module-orthogonality",
    "module-determinants",
    "module-eigenvalues",
    "module-applications"
  ],
  "units": [
    "scalar-introduction",
    "vector-introduction",
    "vector-notation",
    "vector-addition",
    "scalar-multiplication",
    "dot-product-and-norm",
    "linear-equations",
    "matrix-introduction",
    "matrix-operations",
    "gaussian-elimination",
    "rref-and-pivots",
    "inverse-and-lu",
    "vector-spaces",
    "subspaces",
    "linear-combination",
    "span",
    "linear-independence",
    "basis-definition",
    "dimension-and-rank",
    "coordinate-vectors",
    "linear-transformations",
    "kernel-and-image",
    "matrix-representation",
    "coordinate-maps",
    "change-of-basis",
    "composition-and-similarity",
    "orthogonality",
    "orthogonal-complement",
    "projection",
    "orthonormal-bases",
    "gram-schmidt",
    "qr-least-squares",
    "determinant-intuition",
    "determinant-definition",
    "determinant-properties",
    "determinant-computation",
    "determinant-invertibility",
    "determinant-volume",
    "eigenvalue-eigenvector",
    "characteristic-polynomial",
    "eigenspace-and-multiplicity",
    "diagonalization",
    "symmetric-spectral-theorem",
    "positive-definite-matrices",
    "quadratic-forms",
    "svd-intuition",
    "low-rank-approximation",
    "pca-connection",
    "markov-matrices",
    "graph-network-matrices",
    "differential-and-fourier",
    "numerical-stability"
  ],
  "status": "experimental",
  "requirements": {
    "curriculum_review": "pass",
    "required_modules_present": true,
    "terminology_consistency": "pending",
    "notation_consistency": "pending"
  },
  "evidence_review": "curriculum-review/decisions.yaml"
}
